{
  "schema_version": 1,
  "signal_id": "fixture-signal-001",
  "scenario_code": "SCN-008",
  "snapshot_id": "SYNTH-SNAP-001",
  "tenant_id": "fixture-tenant-001",
  "created_at": "2026-08-28T09:00:00Z",
  "trust_marking": "unreleased",
  "rub_assessment": { "value_rub": "12345.67", "method": "revenue" },
  "source_refs": ["artifact://fixture-signal-001/2026-08-28"],
  "detection_data": {
    "sales_delta_ratio": { "value": 0, "is_unknown": false },
    "sellable_stock": { "value": null, "is_unknown": true },
    "quality_status": { "value": "fixture-ok", "is_unknown": false }
  }
}
